{
  "format": "tao-vl-reason-v1.0",
  "metadata": {
    "type": "annotation",
    "task": "grounding",
    "date": "2026-04-10",
    "description": "2D grounding \u2014 vehicle bounding boxes in overhead intersection image.",
    "license": "Apache-2.0",
    "tags": [
      "transportation",
      "grounding",
      "bbox",
      "image"
    ]
  },
  "media_root": null,
  "items": [
    {
      "image_id": "images/image_001.jpg",
      "question": "Locate all vehicles in this overhead intersection image. Return JSON-formatted bounding boxes and labels for each detected vehicle.",
      "answer": "```json\n[\n  {\"bbox_2d\": [112, 340, 285, 420], \"label\": \"sedan\"},\n  {\"bbox_2d\": [430, 210, 620, 310], \"label\": \"pickup_truck\"},\n  {\"bbox_2d\": [290, 480, 450, 560], \"label\": \"bus\"}\n]\n```"
    }
  ]
}
