{
  "format": "tao-vl-reason-v1.0",
  "metadata": {
    "type": "annotation",
    "task": "temporal_localization",
    "description": "ITS collision training samples \u2014 same content as its_collision/, but media is referenced in place instead of copied. media_root is a relative path back to the source metropolis-v3.0 scene; items are file paths under that root.",
    "license": "Apache-2.0"
  },
  "media_root": "../../metropolis-v3.0/its_collision/scene_its_collision_001",
  "items": [
    {
      "video_id": "raw/video_001.mp4",
      "question": "When does the T-bone collision between the white sedan and the red sedan occur?\n\nProvide the result in json format with 'mm:ss' for time depiction. Use keywords 'start', 'end' in the json output.",
      "answer": "```json\n{\n  \"start\": \"00:00:03\",\n  \"end\": \"00:00:04\"\n}\n```",
      "reasoning": "The white sedan begins its left turn at approximately 2.5s. The red sedan approaches from the bottom right. Contact occurs at 3.8s when the red sedan strikes the passenger side of the white sedan. The collision impact and vehicle separation complete by 4.9s."
    },
    {
      "video_id": "raw/video_002.mp4",
      "question": "When does the gray sedan collide with the white sedan?\n\nProvide the result in json format with 'mm:ss' for time depiction. Use keywords 'start', 'end' in the json output.",
      "answer": "```json\n{\n  \"start\": \"00:00:02\",\n  \"end\": \"00:00:04\"\n}\n```",
      "reasoning": "At 2.7s the gray sedan initiates its left turn from the middle lane directly into the path of the white sedan. The side-impact occurs between 3.0-3.5s. By 4.5s the white sedan has been redirected toward the sidewalk."
    }
  ]
}
